Unnamed,Unnamed: 0,key,question,options,survey,Unnamed: 0.1
48,48,SOCIETY_TRANS_W92,Do you think greater social acceptance of people who are transgender (people who identify as a gender that is different from the sex they were assigned at birth) is generally good or bad for our society?,"['Very good for society', 'Somewhat good for society', 'Neither good nor bad for society', 'Somewhat bad for society', 'Very bad for society', 'Refused']",Pew_American_Trends_Panel_W92,
26,26,GAP21Q15_a_W82,"Please compare the US to other developed nations in a few different areas. In each instance, how does the US compare? Healthcare system","['The best', 'Above average', 'Average', 'Below average', 'The worst', 'Refused']",Pew_American_Trends_Panel_W82,
33,33,IMPROVE2_W36,"How much, if anything, do you think having more women in top leadership positions in business and government would do to improve the quality of life for men?","['A lot', 'Some', 'Not much', 'Nothing at all', 'Refused']",Pew_American_Trends_Panel_W36,
7,7,FAMSURV2Mc_W50,"In general, how important, if at all, is having children in order for a man to live a fulfilling life?","['Essential', 'Important, but not essential', 'Not important', 'Refused']",Pew_American_Trends_Panel_W50,7.0
39,39,USMILSIZ_W92,"Thinking about the size of America's military, do you think it should be 'Reduced a great deal', 'Reduced somewhat', 'Kept about as is', 'Increased somewhat', 'Increased a great deal'","['Reduced a great deal', 'Reduced somewhat', 'Kept about as is', 'Increased somewhat', 'Increased a great deal', 'Refused']",Pew_American_Trends_Panel_W92,
71,71,BETTERPOL1F1E_W36,"In general, do you think men or women in high political offices are better at being willing to take risks?","['Men are better', 'Women are better', 'No difference', 'Refused']",Pew_American_Trends_Panel_W36,
46,46,RACESURV18f_W43,"Thinking again about race and race relations in the U.S. in general, how well, if at all, do you think each of these groups get along with each other in our society these days? Hispanics and Asians","['Very well', 'Pretty well', 'Not too well', 'Not at all well', 'Not sure', 'Refused']",Pew_American_Trends_Panel_W43,
36,36,WHYNOTPOLF1B_W36,Please indicate whether you think the following is is a reason why there are fewer women than men in high political offices. Women in politics face gender discrimination,"['Major reason', 'Minor reason', 'Not a reason', 'Refused']",Pew_American_Trends_Panel_W36,
44,44,WHYNOTPOLF1J_W36,Please indicate whether you think the following is is a reason why there are fewer women than men in high political offices. Women aren't encouraged to pursue leadership positions from an early age,"['Major reason', 'Minor reason', 'Not a reason', 'Refused']",Pew_American_Trends_Panel_W36,
71,71,INEQ8_i_W54,"How much, if at all, do you think the following proposals would do to reduce economic inequality in the U.S.? Expanding government benefits for the poor","['A great deal', 'A fair amount', 'Not too much', 'Nothing at all', 'Refused']",Pew_American_Trends_Panel_W54,
52,52,WHYNOTBIZF2G_W36,"For each one of the following, please indicate whether you think it is a reason why there aren't more women in top executive business positions. Women are held to higher standards than men","['Major reason', 'Minor reason', 'Not a reason', 'Refused']",Pew_American_Trends_Panel_W36,
95,95,RACESURV45_W43,How many black people in our country do you think would confront a black friend or family member if they made a racist or racially insensitive comment or joke about people who are white?,"['All or most', 'Some', 'Only a few', 'None', 'Not sure', 'Refused']",Pew_American_Trends_Panel_W43,
83,83,ECON5_h_W54,Do you think the country's current economic conditions are helping or hurting people who are black?,"['Helping a lot', 'Helping a little', 'Hurting a little', 'Hurting a lot', 'Neither helping nor hurting', 'Refused']",Pew_American_Trends_Panel_W54,
